{
  "schema_version": 1,
  "event_id": "d3a6c1f8-2b57-5e94-a0c3-7f1e8b2d4a65",
  "type": "agent.enrollment",
  "session_id": null,
  "timestamp": "2026-10-16T08:30:00Z",
  "device": {
    "serial": "C02XK0AAJGH5",
    "hardware_uuid": "8A1B2C3D-4E5F-6A7B-8C9D-0E1F2A3B4C5D",
    "os_version": "",
    "agent_version": "1.0.0",
    "privileges_version": null
  },
  "user": null,
  "elevation": null,
  "delayed": false,
  "detail": {
    "state": "rotated",
    "device_id": "9b4e7d2c-1a63-4f85-b0d9-6c3a5e8f1d27",
    "key_fingerprint": "7e1d3b5f9a0c2e4681b3d5f7a9c1e3052b4d6f8a0c2e4a6c8e0b2d4f6a8c0e1d",
    "key_storage": "secure_enclave",
    "previous_device_id": "5d2c8e1a-7b4f-4a93-8c6d-0f1e2a3b4c5d",
    "previous_key_storage": "secure_enclave",
    "hardware_uuid_matches": true
  }
}
