{
  "schema_version": 1,
  "event_id": "1c7a7b63-7b1f-4e4f-8a6f-4a3b2d0e8f12",
  "type": "elevation.revoked",
  "session_id": "5d1c2b7a-8e4f-4a6b-9c3d-2e1f0a9b8c7d",
  "timestamp": "2026-10-16T09:31:47.004Z",
  "device": {
    "serial": "C02XK0AAJGH5",
    "hardware_uuid": "8A1B2C3D-4E5F-6A7B-8C9D-0E1F2A3B4C5D",
    "os_version": "26.1.0",
    "agent_version": "0.1.0",
    "privileges_version": "2.5.3"
  },
  "user": { "local_name": "jdoe", "upn": "jane.doe@example.com" },
  "elevation": { "reason": null, "expires": null, "source": "privileges" },
  "delayed": true,
  "detail": {
    "claimed_state": "user",
    "observed_admin": false,
    "verified": true,
    "trigger": "hook"
  }
}
