{
  "schema_version": 1,
  "event_id": "6c2f7ab8-c06e-4d9e-bf1e-9f8a7c5d3e67",
  "type": "agent.tamper",
  "session_id": null,
  "timestamp": "2026-10-16T10:05:00Z",
  "device": {
    "serial": "C02XK0AAJGH5",
    "hardware_uuid": "8A1B2C3D-4E5F-6A7B-8C9D-0E1F2A3B4C5D",
    "os_version": "26.1.0",
    "agent_version": "0.1.0",
    "privileges_version": null
  },
  "user": null,
  "elevation": null,
  "delayed": false,
  "detail": {
    "check": "settings_managed",
    "state": "failed",
    "problem": "set outside MDM: PermanentAdmins"
  }
}
