{
  "schema_version": 1,
  "event_id": "45ee4308-77a6-4d77-8fe0-9677aa758a61",
  "type": "admin.out_of_band_removed",
  "session_id": "7e3d4c9b-0a6f-4c8d-be5f-4a3b2c1d0e9f",
  "timestamp": "2026-10-16T10:05:00Z",
  "device": {
    "serial": "C02XK0AAJGH5",
    "hardware_uuid": "8A1B2C3D-4E5F-6A7B-8C9D-0E1F2A3B4C5D",
    "os_version": "26.1.0",
    "agent_version": "0.2.0",
    "privileges_version": "2.6.0"
  },
  "user": { "local_name": "backdoor", "upn": null },
  "elevation": { "reason": null, "expires": null, "source": "out_of_band" },
  "delayed": false,
  "detail": {
    "trigger": "heartbeat",
    "first_observed": "2026-10-16T10:00:00Z",
    "grace_seconds": 300,
    "observed_admin": false,
    "verified": true
  }
}
