{
  "schema_version": 1,
  "event_id": "4f2e6a1d-9c3b-4e7a-8d5f-1b0c9a8e7d6c",
  "type": "elevation.revoked",
  "session_id": "7e3d4c9b-0a6f-4c8d-be5f-4a3b2c1d0e9f",
  "timestamp": "2026-10-16T10:15:00Z",
  "device": {
    "serial": "C02XK0AAJGH5",
    "hardware_uuid": "8A1B2C3D-4E5F-6A7B-8C9D-0E1F2A3B4C5D",
    "os_version": "26.1.0",
    "agent_version": "0.1.0",
    "privileges_version": "2.5.3"
  },
  "user": { "local_name": "backdoor", "upn": null },
  "elevation": { "reason": null, "expires": null, "source": "out_of_band" },
  "delayed": false,
  "detail": { "trigger": "permanent_admin", "observed_admin": true, "verified": true }
}
